### ISSUE TITLE
WebSockify tries to use a closed socket

### ISSUE THREAD

**Issue by kousu** [novnc/websockify#139]
If WebSockify's client is terminated it tries to tell the client that it has been terminated, causing a RST packet. This isn't terribly harmful, but it's also ugly.

The problem starts at [reasonably enough](https://github.com/kanaka/websockify/blob/master/websockify/websocket.py#L339), reason which [gets converted to an exception](https://github.com/kanaka/websockify/blob/master/websockify/websocketproxy.py#L153), which is then [converted to a packet](https://github.com/kanaka/websockify/blob/master/websockify/websocket.py#L498).  As a workaround, [send_close](https://github.com/kanaka/websockify/blob/master/websockify/websocket.py#L388) could check if its already closed before trying again, but I worry this corner case is more subtle than that. Maybe [recv_frames](https://github.com/kanaka/websockify/blob/master/websockify/websocket.py#L326) should close the connection immediately, so that at least crashes happen server side, not over the network?

Here's a Wireshark packet dissection of the last three packets in such a session.

The first is the TCP FIN from client (46787) to server (8022)

```
Frame 34: 66 bytes on wire (528 bits), 66 bytes captured (528 bits) on interface 0
    Interface id: 0 (lo)
    Encapsulation type: Ethernet (1)
    Arrival Time: Sep 21, 2014 02:33:05.776284000 EDT
    [Time shift for this packet: 0.000000000 seconds]
    Epoch Time: 1411281185.776284000 seconds
    [Time delta from previous captured frame: 119.100215000 seconds]
    [Time delta from previous displayed frame: 119.100215000 seconds]
    [Time since reference or first frame: 119.144615000 seconds]
    Frame Number: 34
    Frame Length: 66 bytes (528 bits)
    Capture Length: 66 bytes (528 bits)
    [Frame is marked: True]
    [Frame is ignored: False]
    [Protocols in frame: eth:ethertype:ip:tcp]
    [Coloring Rule Name: TCP SYN/FIN]
    [Coloring Rule String: tcp.flags & 0x02 || tcp.flags.fin == 1]
Ethernet II, Src: 00:00:00_00:00:00 (00:00:00:00:00:00), Dst: 00:00:00_00:00:00 (00:00:00:00:00:00)
    Destination: 00:00:00_00:00:00 (00:00:00:00:00:00)
        Address: 00:00:00_00:00:00 (00:00:00:00:00:00)
        .... ..0. .... .... .... .... = LG bit: Globally unique address (factory default)
        .... ...0 .... .... .... .... = IG bit: Individual address (unicast)
    Source: 00:00:00_00:00:00 (00:00:00:00:00:00)
        Address: 00:00:00_00:00:00 (00:00:00:00:00:00)
        .... ..0. .... .... .... .... = LG bit: Globally unique address (factory default)
        .... ...0 .... .... .... .... = IG bit: Individual address (unicast)
    Type: IP (0x0800)
Internet Protocol Version 4, Src: 127.0.0.1 (127.0.0.1), Dst: 127.0.0.1 (127.0.0.1)
    Version: 4
    Header Length: 20 bytes
    Differentiated Services Field: 0x00 (DSCP 0x00: Default; ECN: 0x00: Not-ECT (Not ECN-Capable Transport))
        0000 00.. = Differentiated Services Codepoint: Default (0x00)
        .... ..00 = Explicit Congestion Notification: Not-ECT (Not ECN-Capable Transport) (0x00)
    Total Length: 52
    Identification: 0xcbe2 (52194)
    Flags: 0x02 (Don't Fragment)
        0... .... = Reserved bit: Not set
        .1.. .... = Don't fragment: Set
        ..0. .... = More fragments: Not set
    Fragment offset: 0
    Time to live: 64
    Protocol: TCP (6)
    Header checksum: 0x70df [validation disabled]
        [Good: False]
        [Bad: False]
    Source: 127.0.0.1 (127.0.0.1)
    Destination: 127.0.0.1 (127.0.0.1)
Transmission Control Protocol, Src Port: 46787 (46787), Dst Port: 8022 (8022), Seq: 203, Ack: 1877, Len: 0
    Source Port: 46787 (46787)
    Destination Port: 8022 (8022)
    [Stream index: 0]
    [TCP Segment Len: 0]
    Sequence number: 203    (relative sequence number)
    Acknowledgment number: 1877    (relative ack number)
    Header Length: 32 bytes
    .... 0000 0001 0001 = Flags: 0x011 (FIN, ACK)
        000. .... .... = Reserved: Not set
        ...0 .... .... = Nonce: Not set
        .... 0... .... = Congestion Window Reduced (CWR): Not set
        .... .0.. .... = ECN-Echo: Not set
        .... ..0. .... = Urgent: Not set
        .... ...1 .... = Acknowledgment: Set
        .... .... 0... = Push: Not set
        .... .... .0.. = Reset: Not set
        .... .... ..0. = Syn: Not set
        .... .... ...1 = Fin: Set
            [Expert Info (Chat/Sequence): Connection finish (FIN)]
                [Connection finish (FIN)]
                [Severity level: Chat]
                [Group: Sequence]
    Window size value: 1365
    [Calculated window size: 174720]
    [Window size scaling factor: 128]
    Checksum: 0xfe28 [validation disabled]
        [Good Checksum: False]
        [Bad Checksum: False]
    Urgent pointer: 0
    Options: (12 bytes), No-Operation (NOP), No-Operation (NOP), Timestamps
        No-Operation (NOP)
            Type: 1
                0... .... = Copy on fragmentation: No
                .00. .... = Class: Control (0)
                ...0 0001 = Number: No-Operation (NOP) (1)
        No-Operation (NOP)
            Type: 1
                0... .... = Copy on fragmentation: No
                .00. .... = Class: Control (0)
                ...0 0001 = Number: No-Operation (NOP) (1)
        Timestamps: TSval 4031187, TSecr 3995457
            Kind: Time Stamp Option (8)
            Length: 10
            Timestamp value: 4031187
            Timestamp echo reply: 3995457

0000  00 00 00 00 00 00 00 00 00 00 00 00 08 00 45 00   ..............E.
0010  00 34 cb e2 40 00 40 06 70 df 7f 00 00 01 7f 00   .4..@.@.p.......
0020  00 01 b6 c3 1f 56 de 84 3d b1 ef e8 e7 b6 80 11   .....V..=.......
0030  05 55 fe 28 00 00 01 01 08 0a 00 3d 82 d3 00 3c   .U.(.......=...<
0040  f7 41                                             .A

```

Then WebSockify tries to use the now-closed TCP connection to send a WebSocket FIN to the client, with the hilariously helpful reason of "Client closed abruptly"

```
No.     Time           Source                Destination           Protocol Length Info
     36 119.144904000  127.0.0.1             127.0.0.1             WebSocket 92     WebSocket Connection Close [FIN] 
Frame 36: 92 bytes on wire (736 bits), 92 bytes captured (736 bits) on interface 0
    Interface id: 0 (lo)
    Encapsulation type: Ethernet (1)
    Arrival Time: Sep 21, 2014 02:33:05.776573000 EDT
    [Time shift for this packet: 0.000000000 seconds]
    Epoch Time: 1411281185.776573000 seconds
    [Time delta from previous captured frame: 0.000070000 seconds]
    [Time delta from previous displayed frame: 0.000289000 seconds]
    [Time since reference or first frame: 119.144904000 seconds]
    Frame Number: 36
    Frame Length: 92 bytes (736 bits)
    Capture Length: 92 bytes (736 bits)
    [Frame is marked: True]
    [Frame is ignored: False]
    [Protocols in frame: eth:ethertype:ip:tcp:http:websocket]
    [Coloring Rule Name: TCP]
    [Coloring Rule String: tcp]
Ethernet II, Src: 00:00:00_00:00:00 (00:00:00:00:00:00), Dst: 00:00:00_00:00:00 (00:00:00:00:00:00)
    Destination: 00:00:00_00:00:00 (00:00:00:00:00:00)
        Address: 00:00:00_00:00:00 (00:00:00:00:00:00)
        .... ..0. .... .... .... .... = LG bit: Globally unique address (factory default)
        .... ...0 .... .... .... .... = IG bit: Individual address (unicast)
    Source: 00:00:00_00:00:00 (00:00:00:00:00:00)
        Address: 00:00:00_00:00:00 (00:00:00:00:00:00)
        .... ..0. .... .... .... .... = LG bit: Globally unique address (factory default)
        .... ...0 .... .... .... .... = IG bit: Individual address (unicast)
    Type: IP (0x0800)
Internet Protocol Version 4, Src: 127.0.0.1 (127.0.0.1), Dst: 127.0.0.1 (127.0.0.1)
    Version: 4
    Header Length: 20 bytes
    Differentiated Services Field: 0x00 (DSCP 0x00: Default; ECN: 0x00: Not-ECT (Not ECN-Capable Transport))
        0000 00.. = Differentiated Services Codepoint: Default (0x00)
        .... ..00 = Explicit Congestion Notification: Not-ECT (Not ECN-Capable Transport) (0x00)
    Total Length: 78
    Identification: 0x175b (5979)
    Flags: 0x02 (Don't Fragment)
        0... .... = Reserved bit: Not set
        .1.. .... = Don't fragment: Set
        ..0. .... = More fragments: Not set
    Fragment offset: 0
    Time to live: 64
    Protocol: TCP (6)
    Header checksum: 0x254d [validation disabled]
        [Good: False]
        [Bad: False]
    Source: 127.0.0.1 (127.0.0.1)
    Destination: 127.0.0.1 (127.0.0.1)
Transmission Control Protocol, Src Port: 8022 (8022), Dst Port: 46787 (46787), Seq: 1877, Ack: 204, Len: 26
    Source Port: 8022 (8022)
    Destination Port: 46787 (46787)
    [Stream index: 0]
    [TCP Segment Len: 26]
    Sequence number: 1877    (relative sequence number)
    [Next sequence number: 1903    (relative sequence number)]
    Acknowledgment number: 204    (relative ack number)
    Header Length: 32 bytes
    .... 0000 0001 1000 = Flags: 0x018 (PSH, ACK)
        000. .... .... = Reserved: Not set
        ...0 .... .... = Nonce: Not set
        .... 0... .... = Congestion Window Reduced (CWR): Not set
        .... .0.. .... = ECN-Echo: Not set
        .... ..0. .... = Urgent: Not set
        .... ...1 .... = Acknowledgment: Set
        .... .... 1... = Push: Set
        .... .... .0.. = Reset: Not set
        .... .... ..0. = Syn: Not set
        .... .... ...0 = Fin: Not set
    Window size value: 350
    [Calculated window size: 44800]
    [Window size scaling factor: 128]
    Checksum: 0xfe42 [validation disabled]
        [Good Checksum: False]
        [Bad Checksum: False]
    Urgent pointer: 0
    Options: (12 bytes), No-Operation (NOP), No-Operation (NOP), Timestamps
        No-Operation (NOP)
            Type: 1
                0... .... = Copy on fragmentation: No
                .00. .... = Class: Control (0)
                ...0 0001 = Number: No-Operation (NOP) (1)
        No-Operation (NOP)
            Type: 1
                0... .... = Copy on fragmentation: No
                .00. .... = Class: Control (0)
                ...0 0001 = Number: No-Operation (NOP) (1)
        Timestamps: TSval 4031187, TSecr 4031187
            Kind: Time Stamp Option (8)
            Length: 10
            Timestamp value: 4031187
            Timestamp echo reply: 4031187
    [SEQ/ACK analysis]
        [This is an ACK to the segment in frame: 34]
        [The RTT to ACK the segment was: 0.000289000 seconds]
        [iRTT: 0.000019000 seconds]
        [Bytes in flight: 26]
WebSocket
    1... .... = Fin: True
    .000 .... = Reserved: 0x00
    .... 1000 = Opcode: Connection Close (8)
    0... .... = Mask: False
    .001 1000 = Payload length: 24
    Payload
        Close: 03e8436c69656e7420636c6f736564206162727570746c79
        Close: Normal Closure (1000)
        Reason: Client closed abruptly

0000  00 00 00 00 00 00 00 00 00 00 00 00 08 00 45 00   ..............E.
0010  00 4e 17 5b 40 00 40 06 25 4d 7f 00 00 01 7f 00   .N.[@.@.%M......
0020  00 01 1f 56 b6 c3 ef e8 e7 b6 de 84 3d b2 80 18   ...V........=...
0030  01 5e fe 42 00 00 01 01 08 0a 00 3d 82 d3 00 3d   .^.B.......=...=
0040  82 d3 88 18 03 e8 43 6c 69 65 6e 74 20 63 6c 6f   ......Client clo
0050  73 65 64 20 61 62 72 75 70 74 6c 79               sed abruptly
```

Which of course makes the kernel upset and send a RST:

```
No.     Time           Source                Destination           Protocol Length Info
     37 119.144918000  127.0.0.1             127.0.0.1             TCP      54     46787→8022 [RST] Seq=204 Win=0 Len=0

Frame 37: 54 bytes on wire (432 bits), 54 bytes captured (432 bits) on interface 0
    Interface id: 0 (lo)
    Encapsulation type: Ethernet (1)
    Arrival Time: Sep 21, 2014 02:33:05.776587000 EDT
    [Time shift for this packet: 0.000000000 seconds]
    Epoch Time: 1411281185.776587000 seconds
    [Time delta from previous captured frame: 0.000014000 seconds]
    [Time delta from previous displayed frame: 0.000014000 seconds]
    [Time since reference or first frame: 119.144918000 seconds]
    Frame Number: 37
    Frame Length: 54 bytes (432 bits)
    Capture Length: 54 bytes (432 bits)
    [Frame is marked: True]
    [Frame is ignored: False]
    [Protocols in frame: eth:ethertype:ip:tcp]
    [Coloring Rule Name: TCP RST]
    [Coloring Rule String: tcp.flags.reset eq 1]
Ethernet II, Src: 00:00:00_00:00:00 (00:00:00:00:00:00), Dst: 00:00:00_00:00:00 (00:00:00:00:00:00)
    Destination: 00:00:00_00:00:00 (00:00:00:00:00:00)
        Address: 00:00:00_00:00:00 (00:00:00:00:00:00)
        .... ..0. .... .... .... .... = LG bit: Globally unique address (factory default)
        .... ...0 .... .... .... .... = IG bit: Individual address (unicast)
    Source: 00:00:00_00:00:00 (00:00:00:00:00:00)
        Address: 00:00:00_00:00:00 (00:00:00:00:00:00)
        .... ..0. .... .... .... .... = LG bit: Globally unique address (factory default)
        .... ...0 .... .... .... .... = IG bit: Individual address (unicast)
    Type: IP (0x0800)
Internet Protocol Version 4, Src: 127.0.0.1 (127.0.0.1), Dst: 127.0.0.1 (127.0.0.1)
    Version: 4
    Header Length: 20 bytes
    Differentiated Services Field: 0x00 (DSCP 0x00: Default; ECN: 0x00: Not-ECT (Not ECN-Capable Transport))
        0000 00.. = Differentiated Services Codepoint: Default (0x00)
        .... ..00 = Explicit Congestion Notification: Not-ECT (Not ECN-Capable Transport) (0x00)
    Total Length: 40
    Identification: 0x8294 (33428)
    Flags: 0x02 (Don't Fragment)
        0... .... = Reserved bit: Not set
        .1.. .... = Don't fragment: Set
        ..0. .... = More fragments: Not set
    Fragment offset: 0
    Time to live: 64
    Protocol: TCP (6)
    Header checksum: 0xba39 [validation disabled]
        [Good: False]
        [Bad: False]
    Source: 127.0.0.1 (127.0.0.1)
    Destination: 127.0.0.1 (127.0.0.1)
Transmission Control Protocol, Src Port: 46787 (46787), Dst Port: 8022 (8022), Seq: 204, Len: 0
    Source Port: 46787 (46787)
    Destination Port: 8022 (8022)
    [Stream index: 0]
    [TCP Segment Len: 0]
    Sequence number: 204    (relative sequence number)
    Acknowledgment number: 0
    Header Length: 20 bytes
    .... 0000 0000 0100 = Flags: 0x004 (RST)
        000. .... .... = Reserved: Not set
        ...0 .... .... = Nonce: Not set
        .... 0... .... = Congestion Window Reduced (CWR): Not set
        .... .0.. .... = ECN-Echo: Not set
        .... ..0. .... = Urgent: Not set
        .... ...0 .... = Acknowledgment: Not set
        .... .... 0... = Push: Not set
        .... .... .1.. = Reset: Set
            [Expert Info (Warn/Sequence): Connection reset (RST)]
                [Connection reset (RST)]
                [Severity level: Warn]
                [Group: Sequence]
        .... .... ..0. = Syn: Not set
        .... .... ...0 = Fin: Not set
    Window size value: 0
    [Calculated window size: 0]
    [Window size scaling factor: 128]
    Checksum: 0xbf8d [validation disabled]
        [Good Checksum: False]
        [Bad Checksum: False]
    Urgent pointer: 0

0000  00 00 00 00 00 00 00 00 00 00 00 00 08 00 45 00   ..............E.
0010  00 28 82 94 40 00 40 06 ba 39 7f 00 00 01 7f 00   .(..@.@..9......
0020  00 01 b6 c3 1f 56 de 84 3d b2 00 00 00 00 50 04   .....V..=.....P.
0030  00 00 bf 8d 00 00                                 ......
```

**Comment by CendioOssman** [comment]
This may have been fixed with the restructuring.

**Comment by DirectXMan12** [comment]
closing due to age
